{
  "$schema": "https://json-schema.org/draft/2020-12/schema",
  "$id": "urn:credential-evidence:schema:v1:legacy-map",
  "title": "Legacy map",
  "description": "Migration provenance, kept out of canonical identity: for every legacy suite, case and fixture, where it went in the canonical records, or why nothing carries it. Legacy names appear only on the `legacy` side of an entry (this is the provenance field); canonical ids on the other side are real records and are subject to the identity lint. It lets the compatibility exporter regenerate legacy names and lets a consumer trace every legacy fixture (ADR 0007). Lives under migration/ (one record per legacy suite once it is large: migration/legacy-map/<suite>.json). Added in schema revision 1.2.0.",
  "x-schemaRevision": "1.3.0",
  "type": "object",
  "additionalProperties": false,
  "required": ["schemaVersion", "kind", "id", "title", "source", "entries", "lifecycle"],
  "$defs": {
    "canonicalRef": {
      "type": "object",
      "additionalProperties": false,
      "required": ["type", "id"],
      "properties": {
        "type": { "enum": ["case", "scenario", "fixture-plan", "fixture-set", "fixture"] },
        "id": { "type": "string", "minLength": 1, "maxLength": 200 }
      }
    }
  },
  "properties": {
    "schemaVersion": { "const": 1 },
    "kind": { "const": "legacy-map" },
    "id": { "$ref": "urn:credential-evidence:schema:v1:common#/$defs/slug" },
    "title": { "type": "string", "minLength": 1, "maxLength": 200 },
    "source": {
      "type": "object",
      "additionalProperties": false,
      "required": ["repository", "revision"],
      "properties": {
        "repository": { "type": "string", "pattern": "^[A-Za-z0-9_.-]+/[A-Za-z0-9_.-]+$" },
        "revision": { "$ref": "urn:credential-evidence:schema:v1:common#/$defs/gitCommit" }
      }
    },
    "entries": {
      "type": "array",
      "minItems": 1,
      "items": {
        "type": "object",
        "additionalProperties": false,
        "required": ["legacy", "canonical", "relation"],
        "properties": {
          "legacy": {
            "type": "object",
            "additionalProperties": false,
            "required": ["type", "id"],
            "properties": {
              "type": { "enum": ["suite", "case", "fixture"] },
              "id": { "description": "The legacy name, verbatim. The one place a suite, beta or issue coordinate is allowed.", "type": "string", "minLength": 1, "maxLength": 300 },
              "path": { "description": "Where the legacy entity lived: a corpus path for a suite, the fixture's own path inside its corpus, the file the first import wrote for a case.", "type": "string", "minLength": 1, "maxLength": 300 },
              "title": { "description": "A suite's legacy title, verbatim (schema revision 1.3.0).", "type": "string", "minLength": 1, "maxLength": 200 },
              "description": { "description": "A suite's legacy description, verbatim (schema revision 1.3.0).", "$ref": "urn:credential-evidence:schema:v1:common#/$defs/text" },
              "scenarioIds": {
                "description": "The legacy navigation scenario ids the fixture carried in the legacy semantic index (schema revision 1.3.0). They are legacy data, not canonical Scenario ids; only the compatibility exporter reads them.",
                "type": "array",
                "uniqueItems": true,
                "items": { "$ref": "urn:credential-evidence:schema:v1:common#/$defs/slug" }
              }
            }
          },
          "canonical": {
            "description": "The canonical record that now carries it, several records when one legacy entity fans out (a suite, or a case that became a scenario and a plan cell; schema revision 1.3.0), or null when nothing does.",
            "oneOf": [
              { "type": "null" },
              { "$ref": "#/$defs/canonicalRef" },
              { "type": "array", "minItems": 2, "uniqueItems": true, "items": { "$ref": "#/$defs/canonicalRef" } }
            ]
          },
          "relation": {
            "description": "same: carried one to one under a new semantic id. merged: several legacy entries fold into one canonical record. reclassified-as-scenario / reclassified-as-projection: the legacy case was a scenario instance or a matrix cell, not a reasoning unit. dropped: no canonical counterpart (canonical is null).",
            "enum": ["same", "merged", "reclassified-as-scenario", "reclassified-as-projection", "dropped"]
          },
          "note": { "$ref": "urn:credential-evidence:schema:v1:common#/$defs/text" }
        },
        "allOf": [
          {
            "if": { "properties": { "relation": { "const": "dropped" } } },
            "then": { "properties": { "canonical": { "type": "null" } }, "required": ["note"] },
            "else": { "properties": { "canonical": { "type": ["object", "array"] } } }
          }
        ]
      }
    },
    "lifecycle": { "$ref": "urn:credential-evidence:schema:v1:common#/$defs/lifecycle" },
    "externalRefs": { "$ref": "urn:credential-evidence:schema:v1:common#/$defs/externalRefs" },
    "notes": { "$ref": "urn:credential-evidence:schema:v1:common#/$defs/text" }
  }
}
