{
  "schemaVersion": 1,
  "kind": "legacy-map",
  "id": "beta8-213c",
  "title": "Legacy map for suite beta8-213c",
  "source": {
    "repository": "redact-secret/redact-secret-benchmarks",
    "revision": "1020d2b5905e8973098235e57c4cdca3359bba57"
  },
  "entries": [
    {"legacy":{"type":"suite","id":"beta8-213c","path":"fixtures/generated/beta8-213c.json","title":"Beta.8 stable restoration evidence (#213, 213c)","description":"Documented-profile fixtures that restore nine beta.7-stable T1 families (Grafana service accounts, JWT, Netlify, New Relic license and user keys, Pulumi, Supabase management, HCP Terraform, Vault) held provisional only by fixture-profile debt, plus the #206 untwinned positives for six #209 families. The corpus measures and records; it moves no support status by itself."},"canonical":[{"type":"fixture-plan","id":"benign-and-near-miss-controls"},{"type":"fixture-plan","id":"documented-format-positives"},{"type":"scenario","id":"benign-encoded-value"},{"type":"scenario","id":"documented-format-literal"},{"type":"scenario","id":"format-near-miss"},{"type":"scenario","id":"prose-mention"},{"type":"scenario","id":"public-identifier"}],"relation":"reclassified-as-projection","note":"98 fixtures in 39 imported cases (0 case, 0 scenario, 39 projection); every fixture is listed below with its canonical id."},
    {"legacy":{"type":"case","id":"beta8-213c-azure-devops-personal-access-token","path":"records/cases/beta8-213c/beta8-213c-azure-devops-personal-access-token.json"},"canonical":[{"type":"scenario","id":"documented-format-literal"},{"type":"fixture-plan","id":"documented-format-positives"}],"relation":"reclassified-as-projection","note":"rule positive-projection; legacy tier T1; 5 fixtures"},
    {"legacy":{"type":"case","id":"beta8-213c-confluent-cloud-api-secret","path":"records/cases/beta8-213c/beta8-213c-confluent-cloud-api-secret.json"},"canonical":[{"type":"scenario","id":"documented-format-literal"},{"type":"fixture-plan","id":"documented-format-positives"}],"relation":"reclassified-as-projection","note":"rule positive-projection; legacy tier T1; 6 fixtures"},
    {"legacy":{"type":"case","id":"beta8-213c-datadog-application-key","path":"records/cases/beta8-213c/beta8-213c-datadog-application-key.json"},"canonical":[{"type":"scenario","id":"documented-format-literal"},{"type":"fixture-plan","id":"documented-format-positives"}],"relation":"reclassified-as-projection","note":"rule positive-projection; legacy tier T1; 5 fixtures"},
    {"legacy":{"type":"case","id":"beta8-213c-google-api-key","path":"records/cases/beta8-213c/beta8-213c-google-api-key.json"},"canonical":[{"type":"scenario","id":"documented-format-literal"},{"type":"fixture-plan","id":"documented-format-positives"}],"relation":"reclassified-as-projection","note":"rule positive-projection; legacy tier T1; 5 fixtures"},
    {"legacy":{"type":"case","id":"beta8-213c-grafana-service-account-token","path":"records/cases/beta8-213c/beta8-213c-grafana-service-account-token.json"},"canonical":[{"type":"scenario","id":"documented-format-literal"},{"type":"fixture-plan","id":"documented-format-positives"}],"relation":"reclassified-as-projection","note":"rule positive-projection; legacy tier T1; 6 fixtures"},
    {"legacy":{"type":"case","id":"beta8-213c-grafana-service-account-token-control-encoded-value","path":"records/cases/beta8-213c/beta8-213c-grafana-service-account-token-control-encoded-value.json"},"canonical":[{"type":"scenario","id":"benign-encoded-value"},{"type":"fixture-plan","id":"benign-and-near-miss-controls"}],"relation":"reclassified-as-projection","note":"rule control-projection; legacy tier T2; 1 fixture"},
    {"legacy":{"type":"case","id":"beta8-213c-grafana-service-account-token-control-prose","path":"records/cases/beta8-213c/beta8-213c-grafana-service-account-token-control-prose.json"},"canonical":[{"type":"scenario","id":"prose-mention"},{"type":"fixture-plan","id":"benign-and-near-miss-controls"}],"relation":"reclassified-as-projection","note":"rule control-projection; legacy tier T3; 1 fixture"},
    {"legacy":{"type":"case","id":"beta8-213c-grafana-service-account-token-control-public-id","path":"records/cases/beta8-213c/beta8-213c-grafana-service-account-token-control-public-id.json"},"canonical":[{"type":"scenario","id":"public-identifier"},{"type":"fixture-plan","id":"benign-and-near-miss-controls"}],"relation":"reclassified-as-projection","note":"rule control-projection; legacy tier T2; 1 fixture"},
    {"legacy":{"type":"case","id":"beta8-213c-heroku-api-key","path":"records/cases/beta8-213c/beta8-213c-heroku-api-key.json"},"canonical":[{"type":"scenario","id":"documented-format-literal"},{"type":"fixture-plan","id":"documented-format-positives"}],"relation":"reclassified-as-projection","note":"rule positive-projection; legacy tier T1; 5 fixtures"},
    {"legacy":{"type":"case","id":"beta8-213c-jwt","path":"records/cases/beta8-213c/beta8-213c-jwt.json"},"canonical":[{"type":"scenario","id":"documented-format-literal"},{"type":"fixture-plan","id":"documented-format-positives"}],"relation":"reclassified-as-projection","note":"rule positive-projection; legacy tier T3; 6 fixtures"},
    {"legacy":{"type":"case","id":"beta8-213c-jwt-control-encoded-value","path":"records/cases/beta8-213c/beta8-213c-jwt-control-encoded-value.json"},"canonical":[{"type":"scenario","id":"benign-encoded-value"},{"type":"fixture-plan","id":"benign-and-near-miss-controls"}],"relation":"reclassified-as-projection","note":"rule control-projection; legacy tier T2; 1 fixture"},
    {"legacy":{"type":"case","id":"beta8-213c-jwt-control-near-miss","path":"records/cases/beta8-213c/beta8-213c-jwt-control-near-miss.json"},"canonical":[{"type":"scenario","id":"format-near-miss"},{"type":"fixture-plan","id":"benign-and-near-miss-controls"}],"relation":"reclassified-as-projection","note":"rule control-projection; legacy tier T2; 1 fixture"},
    {"legacy":{"type":"case","id":"beta8-213c-jwt-control-public-id","path":"records/cases/beta8-213c/beta8-213c-jwt-control-public-id.json"},"canonical":[{"type":"scenario","id":"public-identifier"},{"type":"fixture-plan","id":"benign-and-near-miss-controls"}],"relation":"reclassified-as-projection","note":"rule control-projection; legacy tier T2; 1 fixture"},
    {"legacy":{"type":"case","id":"beta8-213c-netlify-token","path":"records/cases/beta8-213c/beta8-213c-netlify-token.json"},"canonical":[{"type":"scenario","id":"documented-format-literal"},{"type":"fixture-plan","id":"documented-format-positives"}],"relation":"reclassified-as-projection","note":"rule positive-projection; legacy tier T1; 4 fixtures"},
    {"legacy":{"type":"case","id":"beta8-213c-netlify-token-control-encoded-value","path":"records/cases/beta8-213c/beta8-213c-netlify-token-control-encoded-value.json"},"canonical":[{"type":"scenario","id":"benign-encoded-value"},{"type":"fixture-plan","id":"benign-and-near-miss-controls"}],"relation":"reclassified-as-projection","note":"rule control-projection; legacy tier T2; 1 fixture"},
    {"legacy":{"type":"case","id":"beta8-213c-netlify-token-control-prose","path":"records/cases/beta8-213c/beta8-213c-netlify-token-control-prose.json"},"canonical":[{"type":"scenario","id":"prose-mention"},{"type":"fixture-plan","id":"benign-and-near-miss-controls"}],"relation":"reclassified-as-projection","note":"rule control-projection; legacy tier T3; 1 fixture"},
    {"legacy":{"type":"case","id":"beta8-213c-new-relic-license-key","path":"records/cases/beta8-213c/beta8-213c-new-relic-license-key.json"},"canonical":[{"type":"scenario","id":"documented-format-literal"},{"type":"fixture-plan","id":"documented-format-positives"}],"relation":"reclassified-as-projection","note":"rule positive-projection; legacy tier T1; 6 fixtures"},
    {"legacy":{"type":"case","id":"beta8-213c-new-relic-license-key-control-encoded-value","path":"records/cases/beta8-213c/beta8-213c-new-relic-license-key-control-encoded-value.json"},"canonical":[{"type":"scenario","id":"benign-encoded-value"},{"type":"fixture-plan","id":"benign-and-near-miss-controls"}],"relation":"reclassified-as-projection","note":"rule control-projection; legacy tier T2; 1 fixture"},
    {"legacy":{"type":"case","id":"beta8-213c-new-relic-license-key-control-prose","path":"records/cases/beta8-213c/beta8-213c-new-relic-license-key-control-prose.json"},"canonical":[{"type":"scenario","id":"prose-mention"},{"type":"fixture-plan","id":"benign-and-near-miss-controls"}],"relation":"reclassified-as-projection","note":"rule control-projection; legacy tier T3; 1 fixture"},
    {"legacy":{"type":"case","id":"beta8-213c-new-relic-license-key-control-public-id","path":"records/cases/beta8-213c/beta8-213c-new-relic-license-key-control-public-id.json"},"canonical":[{"type":"scenario","id":"public-identifier"},{"type":"fixture-plan","id":"benign-and-near-miss-controls"}],"relation":"reclassified-as-projection","note":"rule control-projection; legacy tier T2; 1 fixture"},
    {"legacy":{"type":"case","id":"beta8-213c-new-relic-user-api-key","path":"records/cases/beta8-213c/beta8-213c-new-relic-user-api-key.json"},"canonical":[{"type":"scenario","id":"documented-format-literal"},{"type":"fixture-plan","id":"documented-format-positives"}],"relation":"reclassified-as-projection","note":"rule positive-projection; legacy tier T1; 6 fixtures"},
    {"legacy":{"type":"case","id":"beta8-213c-new-relic-user-api-key-control-encoded-value","path":"records/cases/beta8-213c/beta8-213c-new-relic-user-api-key-control-encoded-value.json"},"canonical":[{"type":"scenario","id":"benign-encoded-value"},{"type":"fixture-plan","id":"benign-and-near-miss-controls"}],"relation":"reclassified-as-projection","note":"rule control-projection; legacy tier T2; 1 fixture"},